[
  {
    "id": "E-INDIA-ROSTER-20260923",
    "source_id": "india_portal_calendar_roster",
    "url": "https://www.india.gov.in/calendar?date=2026-09-24",
    "title": "National Portal of India state and Union Territory roster",
    "publisher": "National Portal of India / National Informatics Centre",
    "published_at": null,
    "retrieved_at": "2026-09-24T06:19:18Z",
    "observation_period": null,
    "locator": "States and Union Territories Holiday Calendar navigation; preserved page footer says last reviewed and updated 24 September 2026 at 11:46:04 am. This is a page footer timestamp, not a verified publication time for the roster itself.",
    "sha256": "1544aab352318b38762669f752644b4bcad8efbf8778f5debe612c5fa2f118df",
    "local_snapshot_path": "artifacts/audits/india-roster-2026-09-24.html",
    "rights_status": "metadata_only",
    "source_inspected": true,
    "upstream_evidence_ids": [],
    "access_notes": "Names only, no LGD IDs or boundaries; public page may update in place."
  },
  {
    "id": "E-IMD-ALLINDIA-20260923",
    "source_id": "imd_all_india_daily_graphic",
    "url": "https://mausam.imd.gov.in/ClimateInformation/imdweb/DAY_WEEK/all-india.gif",
    "title": "IMD cumulative rainfall over the country as a whole, 2026",
    "publisher": "India Meteorological Department",
    "published_at": null,
    "retrieved_at": "2026-09-24T06:17:08Z",
    "observation_period": {
      "start": "2026-06-01T00:00:00+05:30",
      "end": "2026-09-23T00:00:00+05:30",
      "timezone": "Asia/Kolkata",
      "kind": "season_to_date",
      "cutoff_convention": "IMD graphic labels dates June 1 through September 23; clock hour is not specified. Times in this record encode calendar dates only."
    },
    "locator": "Middle panel actual 713.3 mm / normal 837.7 mm; bottom panel cumulative % departure -14.9% till Sep.23",
    "sha256": "2a75486b645fe44c6dfd250b7cb90191ccdc9f5d586357cebe34862d9921d18a",
    "local_snapshot_path": "artifacts/audits/imd-all-india-2026-09-23.gif",
    "rights_status": "permitted_excerpt",
    "source_inspected": true,
    "upstream_evidence_ids": [],
    "access_notes": "Mutable official GIF; brief numeric facts extracted, graphic not republished. Normal 1971-2020 appears in panel."
  },
  {
    "id": "E-IMD-HOMO-20260923",
    "source_id": "imd_homogeneous_regions_daily_graphic",
    "url": "https://mausam.imd.gov.in/ClimateInformation/imdweb/DAY_WEEK/homo.gif",
    "title": "IMD rainfall over four homogeneous regions, 2026",
    "publisher": "India Meteorological Department",
    "published_at": null,
    "retrieved_at": "2026-09-24T06:16:00Z",
    "observation_period": {
      "start": "2026-06-01T00:00:00+05:30",
      "end": "2026-09-23T00:00:00+05:30",
      "timezone": "Asia/Kolkata",
      "kind": "season_to_date",
      "cutoff_convention": "IMD graphic labels dates June 1 through September 23; clock hour is not specified. Times in this record encode calendar dates only."
    },
    "locator": "Four right-hand cumulative % departure panels, each labelled till Sep.23; normal 1971-2020 in left panels",
    "sha256": "dfc549134ea2f520fda1a64dd236c67169a5d86fb8f65c8c79b3520b1fef61d0",
    "local_snapshot_path": "artifacts/audits/imd-homo-2026-09-23.gif",
    "rights_status": "permitted_excerpt",
    "source_inspected": true,
    "upstream_evidence_ids": [],
    "access_notes": "Mutable official GIF; brief numeric facts extracted, graphic not republished. Region is IMD homogeneous region, not a state sum."
  },
  {
    "id": "E-IMD-OUTLOOK-20260831",
    "source_id": "imd_september_2026_outlook",
    "url": "https://internal.imd.gov.in/press_release/20260831_pr_5277.pdf",
    "title": "Monthly Outlook for Rainfall and Temperature during September 2026",
    "publisher": "India Meteorological Department",
    "published_at": "2026-08-31T00:00:00+05:30",
    "retrieved_at": "2026-09-24T06:40:25Z",
    "observation_period": {
      "start": "2026-09-01T00:00:00+05:30",
      "end": "2026-09-30T00:00:00+05:30",
      "timezone": "Asia/Kolkata",
      "kind": "month",
      "cutoff_convention": "Dates are calendar precision; 00:00 encodes date only, not a measured cutoff hour."
    },
    "locator": "Printed pp. 1-2, Highlights and section 2; threshold <91% of September 1971-2020 LPA; spatial caveat in Fig. 1.",
    "sha256": "700c9b57533b36861f66ab8d79fe32d9fb7e3669b48b33ad75c25f56a914dfbb",
    "local_snapshot_path": "artifacts/audits/E-IMD-OUTLOOK-20260831.pdf",
    "rights_status": "permitted_excerpt",
    "source_inspected": true,
    "upstream_evidence_ids": [],
    "access_notes": "Dated forecast archive only; no active current card after September 2026."
  },
  {
    "id": "E-JJM-FUNDS-20260331",
    "source_id": "jal_shakti_jjm_2026_funds",
    "url": "https://www.jalshakti-dowr.gov.in/static/uploads/2026/04/fcf34c99623c6988f805fd15151f54ee.pdf",
    "title": "Ministry statement on JJM 2.0 and FY 2025-26 release",
    "publisher": "Ministry of Jal Shakti / Press Information Bureau",
    "published_at": "2026-03-31T13:37:00+05:30",
    "retrieved_at": "2026-09-24T06:40:25Z",
    "observation_period": {
      "start": "2025-04-01T00:00:00+05:30",
      "end": "2026-03-31T00:00:00+05:30",
      "timezone": "Asia/Kolkata",
      "kind": "other",
      "cutoff_convention": "Dates are calendar precision; 00:00 encodes date only, not a measured cutoff hour."
    },
    "locator": "Printed pp. 1-2: Cabinet and guideline dates; five named state releases total INR 1,561.53 crore.",
    "sha256": "a29459e38b6279af4424420253707d766321d9668fa3129b7e45ce123e081d9d",
    "local_snapshot_path": "artifacts/audits/E-JJM-FUNDS-20260331.pdf",
    "rights_status": "permitted_excerpt",
    "source_inspected": true,
    "upstream_evidence_ids": [],
    "access_notes": "Ministry-reported financial release, not expenditure or outcome."
  },
  {
    "id": "E-JJM-CONNECTIONS-20260402",
    "source_id": "jal_shakti_jjm_2026_connections",
    "url": "https://www.jalshakti-dowr.gov.in/static/uploads/2026/04/0c540cebf0bbc74ac5c12965fc818f1d.pdf",
    "title": "Lok Sabha written reply on reported rural tap connections",
    "publisher": "Ministry of Jal Shakti / Press Information Bureau",
    "published_at": "2026-04-02T16:25:00+05:30",
    "retrieved_at": "2026-09-24T06:40:25Z",
    "observation_period": {
      "start": "2026-03-03T00:00:00+05:30",
      "end": "2026-03-03T00:00:00+05:30",
      "timezone": "Asia/Kolkata",
      "kind": "instant",
      "cutoff_convention": "Dates are calendar precision; 00:00 encodes date only, not a measured cutoff hour."
    },
    "locator": "Printed pp. 1-2, opening paragraphs, Lok Sabha USQ 6338; 15.82 crore of about 19.36 crore rural households as on 3 March 2026.",
    "sha256": "519a18cea92b73ad093988e3aa51f94f2448149f7215058aa511f83e99cfd54c",
    "local_snapshot_path": "artifacts/audits/E-JJM-CONNECTIONS-20260402.pdf",
    "rights_status": "permitted_excerpt",
    "source_inspected": true,
    "upstream_evidence_ids": [],
    "access_notes": "State/UT-reported administrative connection count; not functionality."
  },
  {
    "id": "E-NSO-WATER-2018",
    "source_id": "nso_nss_584_water",
    "url": "https://mospi.gov.in/sites/default/files/press_release/Press%2BNote_Report%2BNo%2B584_DWS_76th%20Final.pdf",
    "title": "NSO NSS Report 584 press note on drinking water, sanitation and hygiene",
    "publisher": "National Statistical Office / Ministry of Statistics and Programme Implementation",
    "published_at": "2019-11-23T00:00:00+05:30",
    "retrieved_at": "2026-09-24T06:40:25Z",
    "observation_period": {
      "start": "2018-07-01T00:00:00+05:30",
      "end": "2018-12-31T00:00:00+05:30",
      "timezone": "Asia/Kolkata",
      "kind": "other",
      "cutoff_convention": "Dates are calendar precision; 00:00 encodes date only, not a measured cutoff hour."
    },
    "locator": "Printed p. 1 section 3 sample and p. 2 sections 3.1(c)-(d): premises facility and self-reported year-round sufficiency.",
    "sha256": "90832ed91c54a67d1ef8ebfe8eb4cdd4748b78467eeb78c9e087a7a88f3ea467",
    "local_snapshot_path": "artifacts/audits/E-NSO-WATER-2018.pdf",
    "rights_status": "permitted_excerpt",
    "source_inspected": true,
    "upstream_evidence_ids": [],
    "access_notes": "2018 survey estimates from household responses, not 2026 service observation."
  },
  {
    "id": "E-JJM-FUNCTIONALITY-2024",
    "source_id": "jjm_functionality_2024",
    "url": "https://jaljeevanmission.gov.in/sites/default/files/2025-12/FHTC_National%20Report%202024.pdf",
    "title": "Functionality Assessment of Household Tap Connection: National Report 2024",
    "publisher": "Jal Jeevan Mission",
    "published_at": null,
    "retrieved_at": "2026-09-24T06:40:27Z",
    "observation_period": {
      "start": "2024-07-01T00:00:00+05:30",
      "end": "2024-10-31T00:00:00+05:30",
      "timezone": "Asia/Kolkata",
      "kind": "other",
      "cutoff_convention": "Dates are calendar precision; 00:00 encodes date only, not a measured cutoff hour."
    },
    "locator": "National factsheet p. 2; methods sections 2.3, 3.1, 3.8; quantity section 4.5 pp.31-32, microbiological tests section 4.6.1 p.33, functionality section 4.7 p.36.",
    "sha256": "7d1f1ba033e6231db4add5fad944aedbefceb554a8261896932485ac7ddbe2bd",
    "local_snapshot_path": "artifacts/audits/E-JJM-FUNCTIONALITY-2024.pdf",
    "rights_status": "permitted_excerpt",
    "source_inspected": true,
    "upstream_evidence_ids": [],
    "access_notes": "Sample of villages already recorded covered; household percentages weighted. Quantity estimated from one household flow per habitation; microbiological results from tested samples."
  },
  {
    "id": "E-KA-GAZETTE-DROUGHT-20260922",
    "source_id": "karnataka_drought_order_20260922",
    "url": "https://erajyapatra.karnataka.gov.in/WriteReadData/2026/11325.pdf",
    "title": "Karnataka Gazette, Government Order RD 586 TNR 2026 (Part-1)",